URL,Version,Status,OIDs,Name,Title,Description,Used
http://snomed.info/sct,null,active,"2.16.840.1.113883.6.96",SNOMED_CT,SNOMED CT (all versions),"SNOMED CT is the most comprehensive and precise clinical health terminology product in the world, owned and distributed around the world by The International Health Terminology Standards Development Organisation (IHTSDO).","ValueSet/medication-codes,ValueSet/route-codes,ValueSet/medication-exposure-category-vs"
https://www.ehealth.fgov.be/standards/fhir/core/CodeSystem/cd-hcparty,2.1.2,active,,HCParty,BeCdHcParty,"healthcare party in Belgium.","ValueSet/be-vs-dispenser-types"
https://www.ehealth.fgov.be/standards/fhir/medication/CodeSystem/be-cs-medication-request-reimbursement-type,1.1.0,active,,MedicationRequestReimbursementType,Medication request reimbursement type,"Medication request reimbursement type - instructions for reimbursement of the medication request","ValueSet/MedicationRequestReimbursementTypeVS"
https://www.ehealth.fgov.be/standards/fhir/medication/CodeSystem/medication-line-origin-type,1.1.0,active,,MedicationLineOrigintype,Medication origin type,"Medication treatment origin type - what is the type of care that originated the medication treatment","ValueSet/medication-line-origin-type-vs"
https://www.ehealth.fgov.be/standards/fhir/medication/CodeSystem/medication-type,1.1.0,draft,,BeModelMedicationType,Medication preparation Type,"Medication preparation type","ValueSet/medication-type-vs"
